SatzID	Verb	Satz	Annotator A	Annotator B	Annotator C	Annotator D	Annotator E	Annotator F	Annotator G	Annotator H	Annotator I	
tueba-s2683-1	sagen	' Es ist doch verrückt', sagt Peter Lehmann, Betriebsratsvize und Mitglied im Aufsichtsrat,' niemand will das Geld.'	*	78741	*	*	*	*	*	78848	*	
tueba-s9625-3	sagen	' Wenn wir wieder die Regierung übernehmen, wird dieses Gesetz keinen Bestand haben', sagte Stoiber.	*	*	78848	*	*	*	*	78848	*	
tueba-s94092-1	sagen	' Das ist der Heldenstadt-Blues, weil jeder seine Meinung sagen muß!'	78848	78848	*	*	*	78741	*	78741	78848	
tueba-s98742-1	sagen	' Ich bin für die Partei und für das Böse zuständig', sagt Trittin selbst und meint, daß es in der öffentlichen Wahrnehmung immer auch eine Zuschreibung von bestimmten Rollen gebe.	78848	*	*	78848	78741	*	*	78848	*	
tueba-s104006-2	wissen	Da das Ehepaar Fischer-Menzel über Berufliches nicht sprach, will die Senatorin davon nicht gewußt haben.	*	*	*	77221	*	*	*	77221	*	
tueba-s104694-2	wissen	Die Debatte um das' Schwarzbuch' zeigt: Manche deutsche Linke wollen von den kommunistischen Verbrechen noch immer nichts wissen	77221	*	*	77221	77221	77221	*	77221	*	
tueba-s104666-2	wissen	Die Debatte um das' Schwarzbuch' zeigt: Manche deutsche Linke wollen von den kommunistischen Verbrechen noch immer nichts wissen	77221	*	*	77221	77221	77221	*	77221	*	
